0	1	2	3	4	5	6	7	8	9	10	11	12
Avionic Systems Design option - Aerospace Vehicle Design (MSc)	Cranfield University	Cranfield University	Full time	"Study at Cranfield University
             

              With the ever increasing traffic density of civil aircraft, and the need for increased military precision in conflicts around the world, safer aircraft operations require more sophisticated avionic systems.
             

              This specialist option of the
              
               MSc Aerospace Vehicle Design
              
              provides you with an understanding of avionic systems design, analysis, development, test and airframe integration."	October, March	Please see the university website for further information on fees for this course.	MSc	See website for details	Bedford	United Kingdom	On Campus	https://www.findamasters.com/masters-degrees/course/avionic-systems-design-option-aerospace-vehicle-design-msc/?i50d4274c8935
