0	1	2	3	4	5	6	7	8	9	10	11	12
Advanced Pharmacy Practice - MSc/PGDip	University of Central Lancashire	University of Central Lancashire	Part time	"This clinical programme in Advanced Pharmacy Practice is informed by the latest developments in primary and secondary care. You’ll learn how to meet the challenges of current and emerging practice roles across all healthcare sectors.
             

              In Year 1, we’ll provide you with up-to-date information on clinical pharmacy, evidence-based medicine and public health.
             

              Year 2 is flexible and you’ll be able to choose options to suit your interests. These include modules on: Integrated Care, Acute and Emergency Care, Mental Health, Leadership and Management, as well as a qualification as an Independent Prescriber.
             

              Your different options for this programme include:"	March	Please see the university website for further information on fees for this course.	"MSc
            
            ,
            
             PGDip"	3 years part-time	Preston	United Kingdom	On Campus	https://www.findamasters.com/masters-degrees/course/advanced-pharmacy-practice-msc-pgdip/?i291d5029c47391
